{
  "audit_checksum": "978e910d326e6895b652e256f980bc33203092157334ebe3824ebbf31da1632c",
  "code_commit": "b9a18a8aaef858b985c3f75ef2aa8955ec521e9f",
  "config_checksum": "b54fb86da5ea3011960c9b019ab61429d8c3ce417607a3294b2e843de20f9c4e",
  "consequence": "NONE",
  "entry_gate_checksum": "23d9f0bdb71a2ed26cf3ef89e5be6237fd286a38944f9fed4c6b8f18d4106f18",
  "health_status": "HEALTHY",
  "integrity_checksum": "35b9941782811766762eea067fea53f7c026fbe9ea8699f911c34d648b409d2a",
  "lot39_audit_checksum": "1e29d0b8695a1b8825e1fc91728a6254ad93c689e1f961cfa424e6d5fed8ed41",
  "lot39_delta_fixture_checksum": "1e7528a350ca78e21c4832b4af0ef4763e6bbadec82ea0f55a1005502cadff97",
  "lot39_reconstructed_book_checksum": "a503d56b312cbb21586712fcf929a0381cbc9adde9c5d70700e1f7166ef58dde",
  "lot39_state_checksum": "d21d1c2e2e3ea2a05a4ab156fb4377e865da90808ecdcfbc8161abf99bc796f0",
  "safety": {
    "analysis_only": true,
    "approved_size": 0,
    "execution_allowed": false,
    "external_connectivity_allowed": false,
    "market_event_publication_allowed": false,
    "network_ingestion_allowed": false,
    "order_routing_allowed": false,
    "participant_behavior_inference_explicitly_labeled": true,
    "raw_data_mutation_allowed": false,
    "real_credentials_allowed": false,
    "risk_approval_allowed": false,
    "scenario_score_is_signal": false,
    "signal_generation_allowed": false,
    "trade_allowed": false,
    "used_for_decision": false
  },
  "schema_version": "book-integrity-desynchronization-detector-audit-v1",
  "state_output_checksum": "e601f60e8fad70c4c445955dda503a3b728614936ca17c964cb2ed9c8a927477",
  "veto_checksum": "000613129dbce4bfa189f66a9927c442a557556870381de92aa2b8da8a7951fc"
}
